5154,,WTB3100XBPHI,Basketbalový míč Wilson Team Alliance Philadelphia 76ers hnědý,"Basketbalový míč Wilson Team Alliance Philadelphia 76ers v hnědém provedení je perfektním míčem pro fanoušky týmu Philadelphia 76ers i všechny milovníky basketbalu. Tento míč je vyroben s vysokou kvalitou a precizností, aby poskytl optimální výkon na hřišti.

Míč na basket je vyroben z kvalitního syntetického materiálu, který zaručuje trvanlivost a odolnost. Jeho povrch je navržen tak, aby poskytoval vynikající kontrolu a přesnost při driblování, střelbě a při přihrávkách.

Design tohoto basketbalového míče je inspirován týmem Philadelphia 76ers a zdobí ho jejich oficiální logo. Hnědá barva s bílými a červenými detaily vytváří ikonický vzhled, který ukazuje vaši podporu a vášeň pro tento tým.","<strong>Basketbalový míč Wilson Team Alliance Philadelphia 76ers v hnědém provedení</strong> je perfektním míčem pro fanoušky týmu Philadelphia 76ers i všechny milovníky basketbalu. Tento <strong>míč</strong> je vyroben s vysokou kvalitou a precizností, aby poskytl optimální výkon na hřišti. <strong>Míč na basket</strong> je vyroben z kvalitního syntetického materiálu, který zaručuje trvanlivost a odolnost. Jeho povrch je navržen tak, aby poskytoval vynikající kontrolu a přesnost při driblování, střelbě a při přihrávkách. Design tohoto <strong>basketbalového míče</strong> je inspirován týmem Philadelphia 76ers a zdobí ho jejich oficiální logo. Hnědá barva s bílými a červenými detaily vytváří ikonický vzhled, který ukazuje vaši podporu a vášeň pro tento tým. <strong>Basketbalový míč Wilson Team Alliance Philadelphia 76ers WTB3100XBPHI v hnědé barvě</strong> je skvělou volbou pro trénink, soutěže nebo jednoduchou zábavu s přáteli. S jeho vysokou kvalitou a věrným provedením týmového designu vás nikdy nezklame na hřišti. <strong>Vlastnosti:</strong> Míč značky Wilson Basketbalový míč Univerzální model pro každého Materiál: kompozitní kůže Velikost: 7 Logo výrobce <strong>Barva:</strong> hnědá",publish,1087.79,1086.19,instock,11,yes,0.5,,,,https://storage.googleapis.com/sportovni-eshop-produkty-fotky/images/WTB3100XBPHI-Basketbalovy-mic-Wilson-Team-Alliance-Philadelphia-76ers-hnedy-Sportovni-eshop-cz.jpg|https://storage.googleapis.com/sportovni-eshop-produkty-fotky/images/WTB3100XBPHI-Basketbalovy-mic-Wilson-Team-Alliance-Philadelphia-76ers-hnedy-Sportovni-eshop-cz2.jpg|https://storage.googleapis.com/sportovni-eshop-produkty-fotky/images/WTB3100XBPHI-Basketbalovy-mic-Wilson-Team-Alliance-Philadelphia-76ers-hnedy-Sportovni-eshop-cz3.jpg|https://storage.googleapis.com/sportovni-eshop-produkty-fotky/images/WTB3100XBPHI-Basketbalovy-mic-Wilson-Team-Alliance-Philadelphia-76ers-hnedy-Sportovni-eshop-cz4.jpg,https://storage.googleapis.com/sportovni-eshop-produkty-fotky/images/WTB3100XBPHI-Basketbalovy-mic-Wilson-Team-Alliance-Philadelphia-76ers-hnedy-Sportovni-eshop-cz.jpg,https://storage.googleapis.com/sportovni-eshop-produkty-fotky/images/WTB3100XBPHI-Basketbalovy-mic-Wilson-Team-Alliance-Philadelphia-76ers-hnedy-Sportovni-eshop-cz2.jpg,https://storage.googleapis.com/sportovni-eshop-produkty-fotky/images/WTB3100XBPHI-Basketbalovy-mic-Wilson-Team-Alliance-Philadelphia-76ers-hnedy-Sportovni-eshop-cz3.jpg,https://storage.googleapis.com/sportovni-eshop-produkty-fotky/images/WTB3100XBPHI-Basketbalovy-mic-Wilson-Team-Alliance-Philadelphia-76ers-hnedy-Sportovni-eshop-cz4.jpg,,,,,,,,,,,,,Simple,Sporty > Basketbal > Basketbalové míče|Muži|Ženy,Unisex|Basketbal|Syntetický,visible,no,no,no,no,,0,taxable,,,,Hnědá,,,,,,Syntetický,,,Unisex,,,Basketbal,,,,7,,,,,,,,2|1|0,,,,,,4|1|0,,,1|1|0,,,3|1|0,,,,0|1|0,,,,,,,,,,,,,,,,,,,,,,,,,,,,,,,,
5155,,02187-000,Pomůcka na branku na přesnost střelby Zina Target Net 5x2M černá,"Pomůcka na branku na přesnost střelby Zina Target Net 5x2M v černé barvě je nezbytným nástrojem pro všechny fotbalové nadšence, kteří chtějí zlepšit svou střeleckou přesnost. Tato pomůcka je navržena tak, aby ti poskytla zábavný a efektivní způsob tréninku.

S rozměry 5x2 metry nabízí tato pomůcka na přesnost střelby dostatečnou velikost pro procvičování přesnosti střelby a zlepšení techniky. Černé provedení dodává pomůcce moderní vzhled, který se snadno kombinuje s různými tréninkovými prostředími.","<strong>Pomůcka na branku na přesnost střelby Zina Target Net 5x2M v černé barvě</strong> je nezbytným nástrojem pro všechny fotbalové nadšence, kteří chtějí zlepšit svou střeleckou přesnost. Tato pomůcka je navržena tak, aby ti poskytla zábavný a efektivní způsob tréninku. S rozměry 5x2 metry nabízí tato <strong>pomůcka na přesnost střelby</strong> dostatečnou velikost pro procvičování přesnosti střelby a zlepšení techniky. Černé provedení dodává pomůcce moderní vzhled, který se snadno kombinuje s různými tréninkovými prostředími. <strong>Zina Target Net</strong> je vyrobena z kvalitních a odolných materiálů, které zaručují dlouhou životnost a odolnost vůči opakovanému používání a nárazům míče. Snadno se sestavuje a rozkládá, což umožňuje rychlou a jednoduchou přípravu tréninkového prostoru. S touto pomůckou na branku na přesnost střelby můžeš trénovat různé techniky a cílit na specifické místa branky. Bez ohledu na to, zda jsi začátečník nebo profesionál, <strong>Zina Target Net</strong> ti pomůže zdokonalit tvé dovednosti a posunout tvoji střeleckou přesnost na vyšší úroveň. <strong>Vlastnosti:</strong> Fotbalová pomůcka pro trénink přesnosti střelby je ideálním řešením pro trénink přesného střílení. Má 4 otvory ve čtyřech rohových částech. Stabilní a snadno použitelný systém upevnění umožňuje rychlé a efektivní připevnění matu k brance. Pomůcka je k dispozici ve dvou velikostech: 5m x 2m 7,32m x 2,44m Výhody: Snadná a rychlá montáž Odolná konstrukce Pěkný, sportovní vzhled",publish,3144.79,2652.4,instock,25,yes,1.0,,,,https://storage.googleapis.com/sportovni-eshop-produkty-fotky/images/02187-000-Pomucka-na-branku-na-presnost-strelby-Zina-Target-Net-5x2M-cerna-Sportovni-eshop-cz.jpg,https://storage.googleapis.com/sportovni-eshop-produkty-fotky/images/02187-000-Pomucka-na-branku-na-presnost-strelby-Zina-Target-Net-5x2M-cerna-Sportovni-eshop-cz.jpg,,,,,,,,,,,,,,,,Simple,Muži|Ženy|Sporty > Fotbal,Unisex|Fotbal,visible,no,no,no,no,,0,taxable,,,,Černá,,,,,,,,,Unisex,,5x2 metry,Fotbal,,,,,,,,,,,,1|1|0,,,,,,,,,0|1|0,,3|1|0,2|1|0,,,,,,,,,,,,,,,,,,,,,,,,,,,,,,,,,,,,
5156,,WRT100101,Tenisové míče Wilson Championship Tennis Extra Duty žluté 3 Ks,"Tenisové míče Wilson Championship Tennis Extra Duty v klasickém žlutém provedení jsou ideální volbou pro hráče, kteří hledají vysokou kvalitu a výkon na tenisovém kurtu. Tyto míče na tenis mají extra odolnou konstrukci, která je vhodná pro hrání na tvrdých površích.

Světle žlutá barva míčů zajišťuje skvělou viditelnost a snadnou sledovatelnost na kurtu. Jsou vyrobeny z vysoce kvalitního materiálu, který zaručuje dlouhou životnost a konzistentní let míče.

Tenisové míče Wilson Championship Tennis Extra Duty jsou určeny pro profesionální i rekreační hru. Sada obsahuje 3 míče, které splňují přísné standardy kvality a jsou schválené Mezinárodní tenisovou federací (ITF).","<strong>Tenisové míče Wilson Championship Tennis Extra Duty v klasickém žlutém provedení</strong> jsou ideální volbou pro hráče, kteří hledají vysokou kvalitu a výkon na tenisovém kurtu. Tyto <strong>míče na tenis</strong> mají extra odolnou konstrukci, která je vhodná pro hrání na tvrdých površích. Světle žlutá barva míčů zajišťuje skvělou viditelnost a snadnou sledovatelnost na kurtu. Jsou vyrobeny z vysoce kvalitního materiálu, který zaručuje dlouhou životnost a konzistentní let míče. <strong>Tenisové míče Wilson Championship Tennis Extra Duty</strong> jsou určeny pro profesionální i rekreační hru. Sada obsahuje 3 míče, které splňují přísné standardy kvality a jsou schválené Mezinárodní tenisovou federací (ITF). Připravte se na skvělou tenisovou hru s <strong>tenisovými míči Wilson Championship Tennis Extra Duty v sadě 3 kusů a ve žluté barvě</strong>. S vynikající odolností a výkonem těchto míčů dosáhnete svého nejlepšího výkonu na kurtu. <strong>Vlastnosti:</strong> nejvyšší kvalita a odolnost Dura-Weave povrchový filc Extra Duty - zajišťuje vysokou odolnost tlakové míče baleno v plastových nádobách po 3 kusech",publish,569.21,509.8,instock,94,yes,0.2,,,,https://storage.googleapis.com/sportovni-eshop-produkty-fotky/images/WRT100101-Tenisove-mice-Wilson-Championship-Tennis-Extra-Duty-zlute-3-Ks-Sportovni-eshop-cz.jpg,https://storage.googleapis.com/sportovni-eshop-produkty-fotky/images/WRT100101-Tenisove-mice-Wilson-Championship-Tennis-Extra-Duty-zlute-3-Ks-Sportovni-eshop-cz.jpg,,,,,,,,,,,,,,,,Simple,Muži|Ženy|Sporty > Tenis,Unisex|Tenis,visible,no,no,no,no,,0,taxable,,,3 Ks,Žlutá,,,,,,,,,Unisex,,,Tenis,,,,,,,,,,,3|1|0,1|1|0,,,,,,,,,0|1|0,,,2|1|0,,,,,,,,,,,,,,,,,,,,,,,,,,,,,,,,,,,,
5157,,501058,Tenisové míče Babolat Soft Foam žluté 3 Ks,"Tenisové míče Babolat Soft Foam v klasickém žlutém provedení a v sadě 3 kusů jsou ideální volbou pro začínající tenisové hráče a děti. Tyto míče na tenis mají měkkou pěnovou konstrukci, která minimalizuje riziko zranění a zajišťuje pohodlné hraní.

Díky svému jasně žlutému provedení jsou míče dobře viditelné na kurtu, což pomáhá hráčům sledovat a reagovat na ně. Jsou vyrobeny z měkkého materiálu, který umožňuje lepší kontrolu nad míčem a snadné učení se tenisových technik.

Tenisové míče Babolat Soft Foam jsou vhodné pro hru na vnitřních a venkovních površích. Jsou lehké, snadno se ovládají a pomáhají hráčům získat důvěru ve své pohyby a zlepšit své dovednosti.","<strong>Tenisové míče Babolat Soft Foam v klasickém žlutém provedení a v sadě 3 kusů</strong> jsou ideální volbou pro začínající tenisové hráče a děti. Tyto <strong>míče na tenis</strong> mají měkkou pěnovou konstrukci, která minimalizuje riziko zranění a zajišťuje pohodlné hraní. Díky svému jasně žlutému provedení jsou míče dobře viditelné na kurtu, což pomáhá hráčům sledovat a reagovat na ně. Jsou vyrobeny z měkkého materiálu, který umožňuje lepší kontrolu nad míčem a snadné učení se tenisových technik. <strong>Tenisové míče Babolat Soft Foam</strong> jsou vhodné pro hru na vnitřních a venkovních površích. Jsou lehké, snadno se ovládají a pomáhají hráčům získat důvěru ve své pohyby a zlepšit své dovednosti. S těmito <strong>tenisovými míči Babolat Soft Foam v klasickém žlutém provedení</strong> si užijete bezpečnou a zábavnou hru na tenisovém kurtu. Nechte se inspirovat kvalitou a spolehlivostí těchto míčů a rozvíjejte své tenisové schopnosti s radostí. <strong>Vlastnosti:</strong> Sada 3 tenisových míčů z měkké pěny Tento model se osvědčí při učení základních pravidel hry Doporučeno pro začínající dospělé a děti Hra s tímto modelem vám pomůže pracovat na orientaci, cítění míče a technice úderu Sada obsahuje tři míče <strong>Materiál:</strong> pěna <strong>Barva:</strong> žlutá",publish,627.73,,instock,8,yes,0.3,,,,https://storage.googleapis.com/sportovni-eshop-produkty-fotky/images/501058-Tenisove-mice-Babolat-Soft-Foam-zlute-3-Ks-Sportovni-eshop-cz.jpg,https://storage.googleapis.com/sportovni-eshop-produkty-fotky/images/501058-Tenisove-mice-Babolat-Soft-Foam-zlute-3-Ks-Sportovni-eshop-cz.jpg,,,,,,,,,,,,,,,,Simple,Muži|Ženy|Sporty > Tenis,Unisex|Tenis,visible,no,no,no,no,,0,taxable,,,3 Ks,Žlutá,,,,,,,,,Unisex,,,Tenis,,,,,,,,,,,3|1|0,1|1|0,,,,,,,,,0|1|0,,,2|1|0,,,,,,,,,,,,,,,,,,,,,,,,,,,,,,,,,,,,
5158,,501082,Tenisové míče Babolat Team Clay žluté 3 Ks,"Tenisové míče Babolat Team Clay ve žlutém provedení s jsou navrženy speciálně pro hru na antukových dvorcích. Tyto míče na tenis nabízejí optimální kombinaci odskoku, trvanlivosti a výkonu na tomto povrchu.

Tenisové míče mají klasickou žlutou barvu, která zajišťuje vynikající viditelnost na kurtu. Jsou vyrobeny z kvalitních materiálů, které zaručují odolnost a dlouhou životnost míčů. Díky své konstrukci a povrchové úpravě jsou přizpůsobeny antukovým dvorcům a poskytují hráčům optimální kontrolu a přesnost.

Tenisové míče Babolat Team Clay jsou vhodné pro hráče všech úrovní, kteří hrají na antukovém povrchu. S jejich pomocí můžete vychutnat kvalitní tenisový zážitek a rozvíjet své dovednosti. Sada obsahuje 3 míče, které jsou baleny v praktickém obalu pro snadné přenášení.","<strong>Tenisové míče Babolat Team Clay ve žlutém provedení</strong> s jsou navrženy speciálně pro hru na <strong>antukových dvorcích</strong>. Tyto <strong>míče na tenis</strong> nabízejí optimální kombinaci odskoku, trvanlivosti a výkonu na tomto povrchu. <strong>Tenisové míče</strong> mají klasickou žlutou barvu, která zajišťuje vynikající viditelnost na kurtu. Jsou vyrobeny z kvalitních materiálů, které zaručují odolnost a dlouhou životnost míčů. Díky své konstrukci a povrchové úpravě jsou přizpůsobeny antukovým dvorcům a poskytují hráčům optimální kontrolu a přesnost. <strong>Tenisové míče Babolat Team Clay</strong> jsou vhodné pro hráče všech úrovní, kteří hrají na <strong>antukovém povrchu</strong>. S jejich pomocí můžete vychutnat kvalitní tenisový zážitek a rozvíjet své dovednosti. Sada obsahuje 3 míče, které jsou baleny v praktickém obalu pro snadné přenášení. Připravte se na své nejlepší výkony na antukových dvorcích s <strong>tenisovými míči Babolat Team Clay ve žluté barvě</strong>. Nechte se inspirovat kvalitou a spolehlivostí těchto míčů a projevte svůj tenisový potenciál na maximum. <strong>Vlastnosti:</strong> Sada tenisových míčů Babolat obsahuje vysoce kvalitní model Team Clay, který je novou verzí slavného modelu Roland Garros / French Open Clay. Míče třídy premium jsou vyrobeny z nejvyšší kvality gumového jádra a filcu s vysokým obsahem bavlny, což se promítá do předvídatelného a stálého letu míče. Extrémně odolná konstrukce, která se opotřebovává pomaleji než jiné modely. Sada obsahuje tři kusy. Elasticita: 5/5 Pevnost: 5/5 Komfort: 4/5 <strong>Materiál:</strong> Filc, bavlna <strong>Barva:</strong> žlutá",publish,695.66,687.43,instock,28,yes,0.3,,,,https://storage.googleapis.com/sportovni-eshop-produkty-fotky/images/501082-Tenisove-mice-Babolat-Team-Clay-zlute-3-Ks-Sportovni-eshop-cz.jpg,https://storage.googleapis.com/sportovni-eshop-produkty-fotky/images/501082-Tenisove-mice-Babolat-Team-Clay-zlute-3-Ks-Sportovni-eshop-cz.jpg,,,,,,,,,,,,,,,,Simple,Muži|Ženy|Sporty > Tenis,Unisex|Tenis,visible,no,no,no,no,,0,taxable,,,3 Ks,Žlutá,,,,,,,,,Unisex,Antuka,,Tenis,,,,,,,,,,,4|1|0,2|1|0,,,,,,,,,0|1|0,1|1|0,,3|1|0,,,,,,,,,,,,,,,,,,,,,,,,,,,,,,,,,,,,
5159,,WRT110000,Tenisové míče Wilson Championship Extra Duty žluté 4 Ks,"Tenisové míče Wilson Championship Extra Duty ve žlutém provedení a v sadě 4 kusů jsou vysoce kvalitními a odolnými míči určenými pro náročné tenisové hřiště. S jejich Extra Duty konstrukcí jsou tyto míče ideální volbou pro tvrdé povrchy.

Mají světle žlutou barvu, která zajišťuje skvělou viditelnost na kurtu. Jsou vyrobeny z kvalitního materiálu s Dura-Weave povrchem, který poskytuje vynikající odolnost a konzistentní let míče.

Sada obsahuje 4 míče, které jsou baleny v praktických plastových plechovkách. Tenisové míče Wilson Championship Extra Duty ve žluté barvě jsou schválené Mezinárodní tenisovou federací (ITF) a nabízejí výjimečnou kombinaci výkonu, trvanlivosti a viditelnosti.","<strong>Tenisové míče Wilson Championship Extra Duty ve žlutém provedení a v sadě 4 kusů</strong> jsou vysoce kvalitními a odolnými míči určenými pro náročné tenisové hřiště. S jejich Extra Duty konstrukcí jsou tyto míče ideální volbou pro tvrdé povrchy. Mají světle žlutou barvu, která zajišťuje skvělou viditelnost na kurtu. Jsou vyrobeny z kvalitního materiálu s Dura-Weave povrchem, který poskytuje vynikající odolnost a konzistentní let míče. Sada obsahuje 4 míče, které jsou baleny v praktických plastových plechovkách. <strong>Tenisové míče Wilson Championship Extra Duty ve žluté barvě</strong> jsou schválené Mezinárodní tenisovou federací (ITF) a nabízejí výjimečnou kombinaci výkonu, trvanlivosti a viditelnosti. Připravte se na skvělou tenisovou hru s <strong>tenisovými míči Wilson Championship Extra Duty ve žlutém provedení</strong>. S jejich vynikající kvalitou a výkonem dosáhnete svých nejlepších výkonů na tenisovém kurtu. <strong>Vlastnosti:</strong> Nejvyšší kvalita a odolnost Filc Dura-Weave Extra Duty - nejvhodnější pro tvrdé povrchy Baleno v plastových plechovkách po 4 kusech",publish,623.32,616.85,instock,15,yes,0.4,,,,https://storage.googleapis.com/sportovni-eshop-produkty-fotky/images/WRT110000-Tenisove-mice-Wilson-Championship-Extra-Duty-zlute-4-Ks-Sportovni-eshop-cz.jpg,https://storage.googleapis.com/sportovni-eshop-produkty-fotky/images/WRT110000-Tenisove-mice-Wilson-Championship-Extra-Duty-zlute-4-Ks-Sportovni-eshop-cz.jpg,,,,,,,,,,,,,,,,Simple,Muži|Ženy|Sporty > Tenis,Unisex|Tenis,visible,no,no,no,no,,0,taxable,,,4 Ks,Žlutá,,,,,,,,,Unisex,,,Tenis,,,,,,,,,,,3|1|0,1|1|0,,,,,,,,,0|1|0,,,2|1|0,,,,,,,,,,,,,,,,,,,,,,,,,,,,,,,,,,,,
5160,,WRT125000,Tenisové míče Wilson Roland Garos Clay Court žluté 3 Ks,"Tenisové míče Wilson Roland Garros Clay Court jsou určeny speciálně pro hru na antukových dvorcích. Tyto míče na tenis mají vynikající výkon a odolnost na tomto specifickém povrchu.

Světle žlutá barva míčů zajišťuje skvělou viditelnost a snadnou sledovatelnost na antukovém kurtu. Jsou vyrobeny z kvalitního materiálu a disponují speciálním povrchem, který zajišťuje lepší kontrolu a odraz míče.

Tenisové míče Wilson Roland Garros Clay Court jsou schválené Mezinárodní tenisovou federací (ITF) a jsou používány na prestižním turnaji Roland Garros. Sada obsahuje 3 míče, které poskytují vynikající výkon a spolehlivost při hře na antuce.","<strong>Tenisové míče Wilson Roland Garros Clay Court</strong> jsou určeny speciálně pro hru na <strong>antukových dvorcích</strong>. Tyto <strong>míče na tenis</strong> mají vynikající výkon a odolnost na tomto specifickém povrchu. Světle žlutá barva míčů zajišťuje skvělou viditelnost a snadnou sledovatelnost na antukovém kurtu. Jsou vyrobeny z kvalitního materiálu a disponují speciálním povrchem, který zajišťuje lepší kontrolu a odraz míče. <strong>Tenisové míče Wilson Roland Garros Clay Court</strong> jsou schválené Mezinárodní tenisovou federací (ITF) a jsou používány na prestižním turnaji Roland Garros. Sada obsahuje 3 míče, které poskytují vynikající výkon a spolehlivost při hře na antuce. Připravte se na tenisové zápasy na antukových dvorcích s <strong>tenisovými míči Wilson Roland Garros Clay Court ve žluté barvě</strong>. S těmito míči dosáhnete precizních a přesných úderů a projevíte své nejlepší tenisové dovednosti. <strong>Vlastnosti:</strong> Tenisové míče Wilson Vyrobeno z filcu Sada obsahuje 3 ks Schváleno: ITF Approved <strong>Materiál:</strong> filc <strong>Barva:</strong> žlutá",publish,638.02,,instock,32,yes,0.3,,,,https://storage.googleapis.com/sportovni-eshop-produkty-fotky/images/WRT125000-Tenisove-mice-Wilson-Roland-Garos-Clay-Court-zlute-3-Ks-Sportovni-eshop-cz.jpg,https://storage.googleapis.com/sportovni-eshop-produkty-fotky/images/WRT125000-Tenisove-mice-Wilson-Roland-Garos-Clay-Court-zlute-3-Ks-Sportovni-eshop-cz.jpg,,,,,,,,,,,,,,,,Simple,Muži|Ženy|Sporty > Tenis,Unisex|Tenis,visible,no,no,no,no,,0,taxable,,,3 Ks,Žlutá,,,,,,,,,Unisex,Antuka,,Tenis,,,,,,,,,,,4|1|0,2|1|0,,,,,,,,,0|1|0,1|1|0,,3|1|0,,,,,,,,,,,,,,,,,,,,,,,,,,,,,,,,,,,,
5161,,502082,Tenisové míče Babolat Gold Championship žluté 4 Ks,"Tenisové míče Babolat Gold Championship ve žlutém provedení a v sadě 4 ks jsou ideální volbou pro tenisové nadšence, kteří hledají kvalitní a výkonné míče pro své tréninky a zápasy. Tyto tenisové míče nabízejí optimální kombinaci odskoku, trvanlivosti a přesnosti.

Míče na tenis mají žlutou barvu, která zajišťuje vynikající viditelnost na kurtu. Jsou vyrobeny z vysoce kvalitních materiálů, které zaručují odolnost a dlouhou životnost míčů. Díky své konstrukci poskytují stabilitu a přesnost při každém úderu.

Tenisové míče Babolat Gold Championship jsou vhodné pro různé povrchy a hru na všech úrovních. Jsou schválené a doporučené profesionálními hráči. S těmito míči si užijete dynamický a kvalitní tenisový zážitek.","<strong>Tenisové míče Babolat Gold Championship ve žlutém provedení a v sadě 4 ks</strong> jsou ideální volbou pro tenisové nadšence, kteří hledají kvalitní a výkonné míče pro své tréninky a zápasy. Tyto tenisové míče nabízejí optimální kombinaci odskoku, trvanlivosti a přesnosti. <strong>Míče na tenis</strong> mají žlutou barvu, která zajišťuje vynikající viditelnost na kurtu. Jsou vyrobeny z vysoce kvalitních materiálů, které zaručují odolnost a dlouhou životnost míčů. Díky své konstrukci poskytují stabilitu a přesnost při každém úderu. <strong>Tenisové míče Babolat Gold Championship</strong> jsou vhodné pro různé povrchy a hru na všech úrovních. Jsou schválené a doporučené profesionálními hráči. S těmito míči si užijete dynamický a kvalitní tenisový zážitek. Připravte se na svůj nejlepší výkon s <strong>tenisovými míči Babolat Gold Championships</strong>. Nechte se inspirovat kvalitou a spolehlivostí těchto míčů a zlepšete svou hru na tenisovém kurtu. <strong>Vlastnosti:</strong> Tenisové míče Babolat se osvědčí během tréninku. Netlakové tenisové míče se vyznačují výrazně zvýšenou odolností. Žlutá barva zaručuje dobrou viditelnost. Certifikát ITF potvrzuje vynikající parametry míče. Sada obsahuje 4 míče zabalené v praktické tubě. <strong>Technické údaje:</strong> Komfort: 2/5 Odolnost: 4/5 Elasticita: 3/5",publish,581.85,576.27,instock,12,yes,0.5,,,,https://storage.googleapis.com/sportovni-eshop-produkty-fotky/images/502082-Tenisove-mice-Babolat-Gold-Championship-zlute-4-Ks-Sportovni-eshop-cz.jpg|https://storage.googleapis.com/sportovni-eshop-produkty-fotky/images/502082-Tenisove-mice-Babolat-Gold-Championship-zlute-4-Ks-Sportovni-eshop-cz2.jpg,https://storage.googleapis.com/sportovni-eshop-produkty-fotky/images/502082-Tenisove-mice-Babolat-Gold-Championship-zlute-4-Ks-Sportovni-eshop-cz.jpg,https://storage.googleapis.com/sportovni-eshop-produkty-fotky/images/502082-Tenisove-mice-Babolat-Gold-Championship-zlute-4-Ks-Sportovni-eshop-cz2.jpg,,,,,,,,,,,,,,,Simple,Muži|Ženy|Sporty > Tenis,Unisex|Tenis,visible,no,no,no,no,,0,taxable,,,4 Ks,Žlutá,,,,,,,,,Unisex,,,Tenis,,,,,,,,,,,3|1|0,1|1|0,,,,,,,,,0|1|0,,,2|1|0,,,,,,,,,,,,,,,,,,,,,,,,,,,,,,,,,,,,
