5193,,10135,Basketbalový set pro street basket Meteor 10135 černý,"Představujeme vám basketbalový set pro street basket Meteor v elegantní černé barvě. Tento set na basketbal je ideální pro vytvoření vlastního basketbalového hřiště na ulici nebo ve dvoře.

Obsahuje kompaktní basketbalovou desku s odolným ocelovým obvodem a základnu, kterou lze naplnit vodou nebo pískem pro stabilitu.

Díky svému univerzálnímu designu je vhodný pro hráče všech věkových skupin. Zažijte nekonečné hodiny zábavy a soutěže s tímto basketbalovým setem pro street basket Meteor v černé barvě.","Představujeme vám <strong>basketbalový set pro street basket Meteor v elegantní černé barvě</strong>. Tento <strong>set na basketbal</strong> je ideální pro vytvoření vlastního basketbalového hřiště na ulici nebo ve dvoře. Obsahuje kompaktní basketbalovou desku s odolným ocelovým obvodem a základnu, kterou lze naplnit vodou nebo pískem pro stabilitu. Díky svému univerzálnímu designu je vhodný pro hráče všech věkových skupin. Zažijte nekonečné hodiny zábavy a soutěže s tímto <strong>basketbalovým setem pro street basket Meteor v černé barvě.</strong> <strong>Vlastnosti:</strong> Meteor Street je kompletní basketbalový set, který poskytne spoustu zábavy pro všechny! Nastavitelná (ocelová trubka) umožňuje snadné přizpůsobení hráčům a úrovni dovedností. Základna je pevná (materiál HDPE) a lze naplnit pískem (20 kg) nebo vodou, čímž se koš stane stabilním během hry. Voděodolná síť z nylonu umožňuje bezpečné použití venku, aniž byste se museli obávat nepříznivých povětrnostních podmínek. Odolný ocelový obvod a deska vyrobená z pevného polyetylenu zaručují dlouhou životnost produktu. Deska poskytuje vysokou kvalitu odrazu. Koš je navržen pro děti i dospělé, kteří chtějí hrát venku. Součástí setu je gumový míč (velikost 1,5) a plastová pumpa.",publish,2204.8123,2174.85,instock,132,yes,7.0,,,,https://storage.googleapis.com/sportovni-eshop-produkty-fotky/images/10135-Basketbalovy-set-pro-street-basket-Meteor-10135-cerny-sportovni-eshop-cz.jpg|https://storage.googleapis.com/sportovni-eshop-produkty-fotky/images/10135-Basketbalovy-set-pro-street-basket-Meteor-10135-cerny-sportovni-eshop-cz2.jpg|https://storage.googleapis.com/sportovni-eshop-produkty-fotky/images/10135-Basketbalovy-set-pro-street-basket-Meteor-10135-cerny-sportovni-eshop-cz3.jpg|https://storage.googleapis.com/sportovni-eshop-produkty-fotky/images/10135-Basketbalovy-set-pro-street-basket-Meteor-10135-cerny-sportovni-eshop-cz4.jpg|https://storage.googleapis.com/sportovni-eshop-produkty-fotky/images/10135-Basketbalovy-set-pro-street-basket-Meteor-10135-cerny-sportovni-eshop-cz5.jpg|https://storage.googleapis.com/sportovni-eshop-produkty-fotky/images/10135-Basketbalovy-set-pro-street-basket-Meteor-10135-cerny-sportovni-eshop-cz6.jpg|https://storage.googleapis.com/sportovni-eshop-produkty-fotky/images/10135-Basketbalovy-set-pro-street-basket-Meteor-10135-cerny-sportovni-eshop-cz7.jpg,https://storage.googleapis.com/sportovni-eshop-produkty-fotky/images/10135-Basketbalovy-set-pro-street-basket-Meteor-10135-cerny-sportovni-eshop-cz.jpg,https://storage.googleapis.com/sportovni-eshop-produkty-fotky/images/10135-Basketbalovy-set-pro-street-basket-Meteor-10135-cerny-sportovni-eshop-cz2.jpg,https://storage.googleapis.com/sportovni-eshop-produkty-fotky/images/10135-Basketbalovy-set-pro-street-basket-Meteor-10135-cerny-sportovni-eshop-cz3.jpg,https://storage.googleapis.com/sportovni-eshop-produkty-fotky/images/10135-Basketbalovy-set-pro-street-basket-Meteor-10135-cerny-sportovni-eshop-cz4.jpg,https://storage.googleapis.com/sportovni-eshop-produkty-fotky/images/10135-Basketbalovy-set-pro-street-basket-Meteor-10135-cerny-sportovni-eshop-cz5.jpg,https://storage.googleapis.com/sportovni-eshop-produkty-fotky/images/10135-Basketbalovy-set-pro-street-basket-Meteor-10135-cerny-sportovni-eshop-cz6.jpg,https://storage.googleapis.com/sportovni-eshop-produkty-fotky/images/10135-Basketbalovy-set-pro-street-basket-Meteor-10135-cerny-sportovni-eshop-cz7.jpg,,,,,,,,,,Simple,Muži|Ženy|Sporty > Basketbal,Unisex|Basketbal,visible,no,no,no,no,,0,taxable,,,,Černá,,,,,,,,,Unisex,,,Basketbal,,,,Universální,,,,,,,,2|1|0,,,,,,,,,1|1|0,,,3|1|0,,,,0|1|0,,,,,,,,,,,,,,,,,,,,,,,,,,,,,,,,
5194,,WR8900203001,"Taška na tenisové rakety Wilson černá 61 x 30,5 x 31,5 cm","Představujeme vám tenisovou tašku Wilson WR8900203001 v černém provedení. Perfektní doplněk pro váš tenisový zážitek! Tato elegantní a praktická taška na tenisové rakety je navržena tak, aby uspokojila potřeby každého tenisového hráče.

Nezáleží na tom, zda jste začátečník nebo profesionální tenista, taška na tenisové rakety Wilson v černé barvě vám pomůže organizovat vaše vybavení a transportovat ho snadno a bezstarostně. Připravte se na každý tenisový zážitek s tímto kvalitním a funkčním doplňkem od Wilsonu!","Představujeme vám <strong>tenisovou tašku Wilson WR8900203001 v černém provedení</strong>. Perfektní doplněk pro váš tenisový zážitek! Tato elegantní a praktická <strong>taška na tenisové rakety</strong> je navržena tak, aby uspokojila potřeby každého tenisového hráče. Nezáleží na tom, zda jste začátečník nebo profesionální tenista, <strong>taška na tenisové rakety Wilson v černé barvě</strong> vám pomůže organizovat vaše vybavení a transportovat ho snadno a bezstarostně. Připravte se na každý tenisový zážitek s tímto kvalitním a funkčním doplňkem od Wilsonu! <strong>Prostorný design</strong> <strong>Taška na tenisové rakety</strong> nabízí dostatek místa pro uložení několika tenisových raket, oblečení, obuvi a dalšího tenisového vybavení. Všechno, co potřebujete pro váš tenisový trénink nebo zápas, se vejde do této tašky. <strong>Organizace a přehlednost</strong> Díky různým oddílům a kapsám si můžete snadno rozdělit věci a udržovat je dobře uspořádané. Už nikdy nebudete hledat své vybavení mezi nepořádkem. <strong>Komfortní nošení</strong> Taška je vybavena nastavitelnými popruhy a polstrovanou rukojetí pro pohodlné nošení, ať už ji vezmete na rameno nebo v ruce. <strong>Kvalitní materiál</strong> Wilson si zakládá na kvalitě svých produktů, a taška není výjimkou. Vyrobená z odolného materiálu, který snese náročné podmínky tenisových hřišť. <strong>Elegantní design</strong> Černá barva tašky s logem Wilson dodává produktu elegantní a stylový vzhled. <strong>Vlastnosti:</strong> Tenisová taška Wilson Taška na tenisové rakety vám umožní přenášet sportovní vybavení na trénink nebo zápas. 3 hlavní oddíly pojmou až 6 tenisových raket bez obalů. Uzavírání ve formě dvoustranných zámků. 1 kapsa na přední straně. Zavěšovací rukojeť. Rukojeti s ochrannými pásky na suchý zip (Velcro). Polstrované, nastavitelné ramenní popruhy. Rozměry: 61cm x 30,5cm x 31,5cm <strong>Materiál:</strong> 100% polyester <strong>Barva:</strong> černá",publish,1813.79,,outofstock,0,yes,0.8,,,,"https://storage.googleapis.com/sportovni-eshop-produkty-fotky/images/WR8900203001-Taska-na-tenisove-rakety-Wilson-cerna-61-x-30,5-x-31,5-cm-sportovni-eshop-cz.jpg|https://storage.googleapis.com/sportovni-eshop-produkty-fotky/images/WR8900203001-Taska-na-tenisove-rakety-Wilson-cerna-61-x-30,5-x-31,5-cm-sportovni-eshop-cz2.jpg|https://storage.googleapis.com/sportovni-eshop-produkty-fotky/images/WR8900203001-Taska-na-tenisove-rakety-Wilson-cerna-61-x-30,5-x-31,5-cm-sportovni-eshop-cz3.jpg","https://storage.googleapis.com/sportovni-eshop-produkty-fotky/images/WR8900203001-Taska-na-tenisove-rakety-Wilson-cerna-61-x-30,5-x-31,5-cm-sportovni-eshop-cz.jpg","https://storage.googleapis.com/sportovni-eshop-produkty-fotky/images/WR8900203001-Taska-na-tenisove-rakety-Wilson-cerna-61-x-30,5-x-31,5-cm-sportovni-eshop-cz2.jpg","https://storage.googleapis.com/sportovni-eshop-produkty-fotky/images/WR8900203001-Taska-na-tenisove-rakety-Wilson-cerna-61-x-30,5-x-31,5-cm-sportovni-eshop-cz3.jpg",,,,,,,,,,,,,,Simple,Muži|Ženy|Sporty > Tenis,Unisex|Tenis|100% Polyester,visible,no,no,no,no,,0,taxable,,,,Černá,,,,,,100% Polyester,,6,Unisex,,"61 x 30,5 x 31,5 cm",Tenis,,,,,,,,,Zip,,,1|1|0,,,,,,3|1|0,,6|1|0,0|1|0,,5|1|0,2|1|0,,,,,,,,,4|1|0,,,,,,,,,,,,,,,,,,,,,,,,,,,
5195,,HS-TNK-000016546,Dětská tenisová raketa Tecnifibre Bullit 21 NW 16x17 černá,"Představujeme vám dětskou tenisovou raketu Tecnifibre Bullit 21 NW s provedením v černé barvě. Jedná se o skvělou volbu pro mladé tenisové nadšence! Tato raketa na tenis Tecnifibre je navržena s ohledem na potřeby a velikost dětských hráčů, aby mohli rozvíjet své tenisové dovednosti s lehkostí a radostí.

Ideální pro děti
Dětská tenisová raketa Tecnifibre Bullit 21 NW je speciálně navržena pro děti, aby jim pomohla snadno se naučit základy tenisu a zdokonalit jejich hru.","Představujeme vám <strong>dětskou tenisovou raketu Tecnifibre Bullit 21 NW s provedením v černé barvě</strong>. Jedná se o skvělou volbu pro mladé tenisové nadšence! Tato <strong>raketa na tenis Tecnifibre</strong> je navržena s ohledem na potřeby a velikost dětských hráčů, aby mohli rozvíjet své tenisové dovednosti s lehkostí a radostí. <strong>Ideální pro děti</strong> Dětská tenisová raketa Tecnifibre Bullit 21 NW je speciálně navržena pro děti, aby jim pomohla snadno se naučit základy tenisu a zdokonalit jejich hru. <strong>Nanowave technologie</strong> Raketa na tenis je vybavena inovativní Nanowave technologií, která poskytuje lepší stabilitu a kontrolu nad míčem. <strong>Uspořádání strun</strong> Uspořádání strun 16x17 poskytuje precizní kontrolu a umožňuje hráčům lépe manévrovat s míčem. <strong>Lehká a pohodlná konstrukce</strong> Raketa na tenis má lehkou konstrukci, která umožňuje dětem snadno ovládat údery a hrát s pohodlím. S <strong>dětskou tenisovou raketou Tecnifibre Bullit 21 NW 16x17 v černé barvě</strong> budou tedy vaše děti připraveny na skvělé tenisové výkony a zároveň si užijí radost z hry na tenisovém kurtu! <strong>Vlastnosti:</strong> Zábavná a účinná tenisová raketa BULLIT 21 NW je ideální pro mladé hráče ve věku 5 až 6 let Velmi lehká, snadno se ovládá a umožňuje jednoduché údery Pevná hliníková konstrukce Barevný a nápaditý design, který vás rozveselí na kurtu Dodávána s 3/4 obalem",publish,1136.19,1038.55,instock,2,yes,0.5,,,,https://storage.googleapis.com/sportovni-eshop-produkty-fotky/images/HS-TNK-000016546-Detska-tenisova-raketa-Tecnifibre-Bullit-21-NW-16x17-cerna-Sportovni-eshop-cz.jpg,https://storage.googleapis.com/sportovni-eshop-produkty-fotky/images/HS-TNK-000016546-Detska-tenisova-raketa-Tecnifibre-Bullit-21-NW-16x17-cerna-Sportovni-eshop-cz.jpg,,,,,,,,,,,,,,,,Simple,Sporty > Tenis > Tenisové rakety|Děti,Děti|Tenis,visible,no,no,no,no,,0,taxable,,,,Černá,,,185 gramů,,,,,,Děti,,,Tenis,Nanowave,,,,580 cm2,,260 mm,16x17,,,,1|1|0,,,3|1|0,,,,,,0|1|0,,,2|1|0,5|1|0,,,,6|1|0,,7|1|0,4|1|0,,,,,,,,,,,,,,,,,,,,,,,,,,,,
5196,,236931SC05,Dětská tenisová raketa Head Extreme 21 3 5/8 16x17 šedá,"Představujeme dětskou tenisovou raketu Head Extreme 21 s provedením v šedé barvě (model 236931 SC05) - perfektní volbu pro mladé tenisové nadšence! Tato raketa na tenis je speciálně navržena pro děti, aby rozvíjely své tenisové dovednosti s lehkostí a radostí.

Ideální pro děti
Raketa Head Extreme 21 je navržena s ohledem na potřeby a velikost dětských hráčů. Lehká konstrukce a vhodná velikost raketky umožňují dětem lépe se naučit základní tenisové techniky.","Představujeme <strong>dětskou tenisovou raketu Head Extreme 21 s provedením v šedé barvě</strong> (model 236931 SC05) - perfektní volbu pro mladé tenisové nadšence! Tato <strong>raketa na tenis</strong> je speciálně navržena pro děti, aby rozvíjely své tenisové dovednosti s lehkostí a radostí. <strong>Ideální pro děti</strong> <strong>Raketa Head Extreme 21</strong> je navržena s ohledem na potřeby a velikost dětských hráčů. Lehká konstrukce a vhodná velikost rakety umožňují dětem lépe se naučit základní tenisové techniky. <strong>Precizní kontrola</strong> Uspořádání strun 16x17 poskytuje precizní kontrolu nad míčem a umožňuje lepší řízení úderů. <strong>Pohodlný grip</strong> Raketa je vybavena ergonomicky tvarovaným gripem s velikostí 3 5/8, který poskytuje pohodlí a pevný úchop pro dětské ruce. <strong>Kvalitní konstrukce</strong> Tenisová raketa Head Extreme 21 je vyrobená z kvalitních materiálů, které zajišťují dlouhou životnost a odolnost. <strong>Stylový design</strong> Šedé provedení rakety dodává moderní a atraktivní vzhled, který osloví děti i rodiče. S <strong>dětskou tenisovou raketou Head Extreme 21 3 5/8 16x17 v šedé barvě</strong> bude vaše dítě připraveno rozvíjet své tenisové dovednosti a prožívat tenisovou radost od samého začátku! <strong>Vlastnosti:</strong> Dětská raketa Head se skvěle osvědčí během rekreačních tenisových her. Technologie Damp+ tlumí nárazy. Raketka je dodávána s 3/4 zavíracím obalem s nastavitelným popruhem. <strong>Technické údaje:</strong> věk: 4-6 let materiál: hliník šířka rámu: 20 mm Váha (bez výpletu): 180 g Výplet: tovární délka rakety: 53,5 cm / 21 palců vyvážení: 30,5 cm rozložení strun: 16x17 palců plocha hlavy rakety: 520 cm² omotávka: tovární",publish,1087.79,,instock,5,yes,0.5,,,,https://storage.googleapis.com/sportovni-eshop-produkty-fotky/images/236931SC05-Detska-tenisova-raketa-Head-Extreme-21-3-58-16x17-seda-Sportovni-eshop-cz.jpg,https://storage.googleapis.com/sportovni-eshop-produkty-fotky/images/236931SC05-Detska-tenisova-raketa-Head-Extreme-21-3-58-16x17-seda-Sportovni-eshop-cz.jpg,,,,,,,,,,,,,,,,Simple,Sporty > Tenis > Tenisové rakety|Děti,Děti|Tenis,visible,no,no,no,no,,0,taxable,,,,Šedá,,,180 gramů,,,,,,Děti,,,Tenis,,,,,520 cm2,,305 mm,16x17,,,,1|1|0,,,3|1|0,,,,,,0|1|0,,,2|1|0,,,,,5|1|0,,6|1|0,4|1|0,,,,,,,,,,,,,,,,,,,,,,,,,,,,
5197,,236941SC05,Dětská tenisová raketa Head Extreme 19 3 5/8 16x17 šedá,"Představujeme vám dětskou tenisovou raketu Head Extreme 19 s provedením v šedé barvě (model 236941 SC05). Raketa na tenis je ideální volbou pro nejmladší tenisové nadšence! Tato tenisová raketa Head je navržena tak, aby dětem umožnila snadno se seznámit s tenisem a rozvíjet své dovednosti s radostí a pohodlím.

Vhodná pro nejmladší hráče
Dětská tenisová raketa Head Extreme 19 je speciálně navržena pro děti v nejmladším věku, aby se s tenisem seznámily a začaly hrát s lehkostí.","Představujeme vám <strong>dětskou tenisovou raketu Head Extreme 19 s provedením v šedé barvě (model 236941 SC05)</strong>. <strong>Raketa na tenis</strong> je ideální volbou pro nejmladší tenisové nadšence! Tato <strong>tenisová raketa Head</strong> je navržena tak, aby dětem umožnila snadno se seznámit s tenisem a rozvíjet své dovednosti s radostí a pohodlím. <strong>Vhodná pro nejmladší hráče</strong> Dětská tenisová raketa Head Extreme 19 je speciálně navržena pro děti v nejmladším věku, aby se s tenisem seznámily a začaly hrát s lehkostí. <strong>Pohodlný grip</strong> Raketa na tenis má ergonomicky tvarovaný grip s velikostí 3 5/8, který poskytuje pohodlí a pevný úchop pro dětské ruce. <strong>Damp+ technologie</strong> Speciální technologie Damp+ tlumí nárazy a snižuje vibrace, čímž zvyšuje komfort a stabilitu během hry. <strong>Precizní kontrola</strong> Uspořádání strun 16x17 poskytuje precizní kontrolu nad míčem, což je ideální pro začínající hráče. <strong>Lehká konstrukce</strong> Raketa je navržena s ohledem na potřeby nejmenších hráčů a má snadno ovladatelnou a lehkou konstrukci. S <strong>dětskou tenisovou raketou Head Extreme 19 3 5/8 16x17236941 SC05 v šedé barvě</strong> si vaše dítě užije první tenisové zážitky a bude se těšit na každé hraní! <strong>Vlastnosti:</strong> Dětská tenisová raketa Head je ideální pro rekreační tenisové hry. Technologie Damp+ tlumí nárazy. Raketa je dodávána s 3/4 zavíracím obalem s nastavitelným popruhem. <strong>Technické údaje:</strong> věk: 2-4 roky materiál: hliník šířka rámu: 20 mm Váha (bez výpletu): 175 g výplet rakety: tovární délka rakety: 48,5 cm / 19 palců vyvážení: 30,5 cm rozložení strun: 16x17 palců plocha hlavy rakety: 520 cm² omotávka: tovární",publish,1087.79,,instock,2,yes,0.5,,,,https://storage.googleapis.com/sportovni-eshop-produkty-fotky/images/236941SC05-Detska-tenisova-raketa-Head-Extreme-19-3-58-16x17-seda-Sportovni-eshop-cz.jpg,https://storage.googleapis.com/sportovni-eshop-produkty-fotky/images/236941SC05-Detska-tenisova-raketa-Head-Extreme-19-3-58-16x17-seda-Sportovni-eshop-cz.jpg,,,,,,,,,,,,,,,,Simple,Sporty > Tenis > Tenisové rakety|Děti,Děti|Tenis,visible,no,no,no,no,,0,taxable,,,,Šedá,,,175 gramů,,,,,,Děti,,,Tenis,Damp+,,,,520 cm2,,305 mm,16x17,,,,1|1|0,,,3|1|0,,,,,,0|1|0,,,2|1|0,5|1|0,,,,6|1|0,,7|1|0,4|1|0,,,,,,,,,,,,,,,,,,,,,,,,,,,,
5198,,236941SC06,Dětská tenisová raketa Head Extreme 19 3 3/4 16x17 šedá,"Představujeme vám dětskou tenisovou raketu Head Extreme 19 19 3 3/4 16x17 v šedé barvě (model 236941 SC06) - dokonalou volbu pro nejmladší tenisové nadšence! Tato raketa na tenis je navržena tak, aby mladým hráčům umožnila snadno se seznámit s tenisem a rozvíjet své dovednosti s radostí a pohodlím.

Ideální pro nejmladší hráče
Dětská tenisová raketa Head Extreme 19 je speciálně navržena pro děti ve věku 2-4 let, aby se s tenisem seznámily a začaly hrát s lehkostí.

Pohodlný grip
Raketa má ergonomicky tvarovaný grip s velikostí 3 3/4, který poskytuje pohodlí a pevný úchop pro dětské ruce.","Představujeme vám <strong>dětskou tenisovou raketu Head Extreme 19 19 3 3/4 16x17 v šedé barvě (model 236941 SC06)</strong> - dokonalou volbu pro nejmladší tenisové nadšence! Tato <strong>raketa na tenis</strong> je navržena tak, aby mladým hráčům umožnila snadno se seznámit s tenisem a rozvíjet své dovednosti s radostí a pohodlím. <strong>Ideální pro nejmladší hráče</strong> Dětská tenisová raketa Head Extreme 19 je speciálně navržena pro děti ve věku 2-4 let, aby se s tenisem seznámily a začaly hrát s lehkostí. <strong>Pohodlný grip</strong> Raketa má ergonomicky tvarovaný grip s velikostí 3 3/4, který poskytuje pohodlí a pevný úchop pro dětské ruce. <strong>Damp+ technologie</strong> Speciální technologie Damp+ tlumí nárazy a snižuje vibrace, čímž zvyšuje komfort a stabilitu během hry. <strong>Precizní kontrola</strong> Uspořádání strun 16x17 poskytuje precizní kontrolu nad míčem, což je ideální pro začínající hráče. <strong>Lehká konstrukce</strong> Raketa na tenis je navržena s ohledem na potřeby nejmenších hráčů a má snadno ovladatelnou a lehkou konstrukci. S <strong>dětskou tenisovou raketou Head Extreme 19 3 3/4 16x17 236941 SC06 v šedé barvě</strong> si vaše dítě užije první tenisové zážitky a bude se těšit na každé hraní! <strong>Vlastnosti:</strong> Dětská tenisová raketa Head je ideální pro rekreační tenisové hry. Technologie Damp+ tlumí nárazy. Raketa je dodávána s 3/4 zavíracím obalem s nastavitelným popruhem. <strong>Technické údaje:</strong> věk: 2-4 roky materiál: hliník šířka rámu: 20 mm Váha (bez výpletu): 175 g výplet: tovární délka rakety: 48,5 cm / 19 palců vyvážení: 30,5 cm rozložení strun: 16x17 palců plocha hlavy rakety: 520 cm² omotávka: tovární",publish,1087.79,,instock,3,yes,0.5,,,,https://storage.googleapis.com/sportovni-eshop-produkty-fotky/images/236941SC06-Detska-tenisova-raketa-Head-Extreme-19-3-34-16x17-seda-Sportovni-eshop-cz.jpg,https://storage.googleapis.com/sportovni-eshop-produkty-fotky/images/236941SC06-Detska-tenisova-raketa-Head-Extreme-19-3-34-16x17-seda-Sportovni-eshop-cz.jpg,,,,,,,,,,,,,,,,Simple,Sporty > Tenis > Tenisové rakety|Děti,Děti|Tenis,visible,no,no,no,no,,0,taxable,,,,Šedá,,,175 gramů,,,,,,Děti,,,Tenis,Damp+,,,,520 cm2,,305 mm,16x17,,,,1|1|0,,,3|1|0,,,,,,0|1|0,,,2|1|0,5|1|0,,,,6|1|0,,7|1|0,4|1|0,,,,,,,,,,,,,,,,,,,,,,,,,,,,
5199,,1212041,Tenisová raketa Babolat Eagle Strung G1 16x20 oranžová,"Představujeme vám tenisovou raketu Babolat Eagle Strung G1 16x20 v oranžovém provedení - skvělou volbu pro všechny tenisové nadšence! Tato raketa na tenis je navržena s důrazem na výkon a kontrolu, která vám pomůže dosáhnout lepšího výkonu na kurtu.","Představujeme vám <strong>tenisovou raketu Babolat Eagle Strung G1 16x20 v oranžovém provedení</strong> - skvělou volbu pro všechny tenisové nadšence! Tato <strong>raketa na tenis</strong> je navržena s důrazem na výkon a kontrolu, která vám pomůže dosáhnout lepšího výkonu na kurtu. <strong>Vynikající kontrola</strong> Raketa na tenis má vzor výpletu 16x20, což poskytuje vynikající kontrolu nad míčem. Budete mít precizní a stabilní údery, které umožní lepší řízení hry. <strong>Pohodlný grip</strong> Tenisová raketa je vybavena pohodlným gripem, který poskytuje pevný úchop a zároveň minimalizuje otřesy a vibrace při úderech. <strong>Univerzální váha a velikost</strong> S univerzální váhou a velikostí je tato tenisová raketa vhodná pro širokou škálu hráčů, od začátečníků po pokročilé. <strong>Kvalitní konstrukce</strong> Raketa je vyrobena z kvalitních materiálů, které zaručují dlouhou životnost a odolnost. <strong>Stylové provedení</strong> Oranžové provedení dodává raketě moderní a svěží vzhled, který si oblíbíte na první pohled. S <strong>tenisovou raketou Babolat Eagle Strung G1 16x20 v oranžové barvě</strong> budete připraveni na své nejlepší tenisové výkony. Užijte si tenisovou radost s touto skvělou raketkou od renomované značky Babolat! <strong>Vlastnosti:</strong> Tenisová raketka Babolat Eagle Strung G1 s obalem Raketa Babolat je navržena pro začátečníky nebo občasné hráče. Raketa je dodávána s obalem. Vyrobená z hliníku. Technické údaje: konstrukce: hliník délka (mm/palec): 685/27 velikost hlavy (cm2/palců2): 685/105 vzor výpletu: 16/20 obal: ano váha: 280 gramů vyvážení: 330 mm",publish,1208.79,893.28,instock,1,yes,0.4,,,,https://storage.googleapis.com/sportovni-eshop-produkty-fotky/images/1212041-Tenisova-raketa-Babolat-Eagle-Strung-G1-16x20-oranzova-Sportovni-eshop-cz.jpg|https://storage.googleapis.com/sportovni-eshop-produkty-fotky/images/1212041-Tenisova-raketa-Babolat-Eagle-Strung-G1-16x20-oranzova-Sportovni-eshop-cz2.jpg,https://storage.googleapis.com/sportovni-eshop-produkty-fotky/images/1212041-Tenisova-raketa-Babolat-Eagle-Strung-G1-16x20-oranzova-Sportovni-eshop-cz.jpg,https://storage.googleapis.com/sportovni-eshop-produkty-fotky/images/1212041-Tenisova-raketa-Babolat-Eagle-Strung-G1-16x20-oranzova-Sportovni-eshop-cz2.jpg,,,,,,,,,,,,,,,Simple,Sporty > Tenis > Tenisové rakety|Muži|Ženy,Unisex|Tenis,visible,no,no,no,no,,0,taxable,,,,Oranžová,,,280 gramů,,,,,,Unisex,,,Tenis,,,,,685 cm2,,330 mm,16x20,,,,1|1|0,,,3|1|0,,,,,,0|1|0,,,2|1|0,,,,,5|1|0,,6|1|0,4|1|0,,,,,,,,,,,,,,,,,,,,,,,,,,,,
